{
  "$schema": "https://json-schema.org/draft/2020-12/schema",
  "$id": "https://rwkv-agent.local/contracts/worker-capability-v1.schema.json",
  "title": "StatePool Worker Capability v1",
  "type": "object",
  "additionalProperties": false,
  "required": [
    "contract_version",
    "worker_id",
    "zone",
    "endpoint",
    "lifecycle",
    "models",
    "device",
    "capacity",
    "reported_at_ms"
  ],
  "properties": {
    "contract_version": { "const": "statepool-worker-capability.v1" },
    "worker_id": { "type": "string", "minLength": 1, "maxLength": 128 },
    "zone": { "enum": ["local", "edge", "cloud"] },
    "endpoint": { "type": "string", "format": "uri" },
    "lifecycle": { "enum": ["starting", "ready", "draining", "offline"] },
    "models": {
      "type": "array",
      "minItems": 1,
      "items": { "$ref": "stateful-inference-session-v1.schema.json#/$defs/model_ref" }
    },
    "device": {
      "type": "object",
      "additionalProperties": false,
      "required": ["vendor", "model", "memory_bytes"],
      "properties": {
        "vendor": { "type": "string", "minLength": 1 },
        "model": { "type": "string", "minLength": 1 },
        "runtime": { "type": "string" },
        "memory_bytes": { "type": "integer", "minimum": 0 }
      }
    },
    "capacity": {
      "type": "object",
      "additionalProperties": false,
      "required": ["state_slots", "free_state_slots", "max_batch", "queue_depth", "running_requests"],
      "properties": {
        "state_slots": { "type": "integer", "minimum": 1 },
        "free_state_slots": { "type": "integer", "minimum": 0 },
        "max_batch": { "type": "integer", "minimum": 1 },
        "queue_depth": { "type": "integer", "minimum": 0 },
        "running_requests": { "type": "integer", "minimum": 0 },
        "unpersisted_state_slots": { "type": ["integer", "null"], "minimum": 0 }
      }
    },
    "state_capability": {
      "description": "Model-runtime State semantics. Optional for backward compatibility; omitted v1 RWKV Workers mean native_export.",
      "oneOf": [
        {
          "type": "object",
          "additionalProperties": false,
          "required": ["mode", "affinity", "snapshot", "restore", "portable_across_workers"],
          "properties": {
            "mode": { "const": "replay_only" },
            "affinity": { "const": false },
            "snapshot": { "const": false },
            "restore": { "const": false },
            "portable_across_workers": { "const": false }
          }
        },
        {
          "type": "object",
          "additionalProperties": false,
          "required": ["mode", "affinity", "snapshot", "restore", "portable_across_workers"],
          "properties": {
            "mode": { "const": "affinity_only" },
            "affinity": { "const": true },
            "snapshot": { "const": false },
            "restore": { "const": false },
            "portable_across_workers": { "const": false }
          }
        },
        {
          "type": "object",
          "additionalProperties": false,
          "required": ["mode", "affinity", "snapshot", "restore", "portable_across_workers"],
          "properties": {
            "mode": { "const": "native_export" },
            "affinity": { "const": true },
            "snapshot": { "const": true },
            "restore": { "const": true },
            "portable_across_workers": { "const": true }
          }
        }
      ]
    },
    "price": {
      "type": ["object", "null"],
      "additionalProperties": false,
      "required": ["currency", "per_gpu_hour"],
      "properties": {
        "currency": { "type": "string", "pattern": "^[A-Z]{3}$" },
        "per_gpu_hour": { "type": "number", "minimum": 0 }
      }
    },
    "labels": {
      "type": "object",
      "additionalProperties": { "type": "string" }
    },
    "reported_at_ms": { "type": "integer", "minimum": 0 }
  }
}
